{
  "schemaVersion": 1,
  "site": {
    "name": "Susie Carson Research Room",
    "organization": "Southport Historical Society",
    "tagline": "The records are still here. Come find the story.",
    "intro": "Photographs, family files, newspaper columns, reports, and recorded voices from Southport and Brunswick County.",
    "mosaicItemIds": [
      "demo-0001",
      "demo-0002",
      "demo-0003",
      "demo-0004",
      "demo-0005",
      "demo-0006"
    ],
    "features": [
      {
        "itemId": "demo-0007",
        "query": "smithville",
        "kicker": "1792–1887",
        "title": "Smithville becomes Southport",
        "blurb": "Explore records connected to the town before and after its change of name."
      },
      {
        "itemId": "demo-0004",
        "query": "hazel",
        "kicker": "October 1954",
        "title": "Hurricane Hazel",
        "blurb": "Photographs and records of the storm and the waterfront it changed."
      },
      {
        "itemId": "demo-0002",
        "query": "menhaden",
        "kicker": "1917–1970s",
        "title": "The menhaden fleet",
        "blurb": "Boats, workers, plants, and the working waterfront."
      },
      {
        "itemId": "demo-0003",
        "query": "lighthouse",
        "kicker": "1817–present",
        "title": "Lights on the shoals",
        "blurb": "Lighthouses, lightships, and their keepers."
      },
      {
        "itemId": "demo-0001",
        "query": "whittler",
        "kicker": "1890s–today",
        "title": "The Whittler's Bench",
        "blurb": "The landmark, the people around it, and the newsletter named for it."
      },
      {
        "itemId": "demo-0005",
        "query": "keziah",
        "kicker": "1930s–1960s",
        "title": "Bill Keziah's Southport",
        "blurb": "The reporter and promoter behind—and sometimes in front of—the camera."
      }
    ]
  },
  "collections": [
    {
      "id": "area-photographs",
      "title": "Photographs",
      "description": "Photographs materials in this development sample. Replace this fixture with curator-authored collection copy.",
      "parentId": null,
      "sortOrder": 100,
      "status": "published"
    },
    {
      "id": "area-susie-carson",
      "title": "Susie Carson",
      "description": "Susie Carson materials in this development sample. Replace this fixture with curator-authored collection copy.",
      "parentId": null,
      "sortOrder": 200,
      "status": "published"
    },
    {
      "id": "area-periodicals",
      "title": "Periodicals",
      "description": "Periodicals materials in this development sample. Replace this fixture with curator-authored collection copy.",
      "parentId": null,
      "sortOrder": 300,
      "status": "published"
    },
    {
      "id": "area-reference",
      "title": "Reference",
      "description": "Reference materials in this development sample. Replace this fixture with curator-authored collection copy.",
      "parentId": null,
      "sortOrder": 400,
      "status": "published"
    },
    {
      "id": "area-genealogy",
      "title": "Genealogy",
      "description": "Genealogy materials in this development sample. Replace this fixture with curator-authored collection copy.",
      "parentId": null,
      "sortOrder": 500,
      "status": "published"
    },
    {
      "id": "area-organizations",
      "title": "Organizations",
      "description": "Organizations materials in this development sample. Replace this fixture with curator-authored collection copy.",
      "parentId": null,
      "sortOrder": 600,
      "status": "published"
    },
    {
      "id": "area-voices",
      "title": "Voices",
      "description": "Voices materials in this development sample. Replace this fixture with curator-authored collection copy.",
      "parentId": null,
      "sortOrder": 700,
      "status": "published"
    },
    {
      "id": "collection-photographs-the-way-it-was-1900-1910",
      "title": "The Way It Was · 1900-1910",
      "description": "Curator-authored description to be supplied.",
      "parentId": "area-photographs",
      "sortOrder": 1,
      "status": "published",
      "coverItemId": "demo-0001"
    },
    {
      "id": "collection-photographs-the-way-it-was-1911-1920",
      "title": "The Way It Was · 1911-1920",
      "description": "Curator-authored description to be supplied.",
      "parentId": "area-photographs",
      "sortOrder": 2,
      "status": "published",
      "coverItemId": "demo-0002"
    },
    {
      "id": "collection-photographs-1800s",
      "title": "1800s",
      "description": "Curator-authored description to be supplied.",
      "parentId": "area-photographs",
      "sortOrder": 3,
      "status": "published",
      "coverItemId": "demo-0003"
    },
    {
      "id": "collection-photographs-the-way-it-was-1951-1960",
      "title": "The Way It Was · 1951-1960",
      "description": "Curator-authored description to be supplied.",
      "parentId": "area-photographs",
      "sortOrder": 4,
      "status": "published",
      "coverItemId": "demo-0004"
    },
    {
      "id": "collection-photographs-the-way-it-was-1921-1930",
      "title": "The Way It Was · 1921-1930",
      "description": "Curator-authored description to be supplied.",
      "parentId": "area-photographs",
      "sortOrder": 5,
      "status": "published",
      "coverItemId": "demo-0006"
    },
    {
      "id": "collection-reference-southport-smithville",
      "title": "Southport/Smithville",
      "description": "Curator-authored description to be supplied.",
      "parentId": "area-reference",
      "sortOrder": 6,
      "status": "published",
      "coverItemId": "demo-0007"
    },
    {
      "id": "collection-photographs-portraits-people",
      "title": "Portraits · People",
      "description": "Curator-authored description to be supplied.",
      "parentId": "area-photographs",
      "sortOrder": 7,
      "status": "published",
      "coverItemId": "demo-0008"
    },
    {
      "id": "collection-susie-carson-landmarks",
      "title": "Landmarks",
      "description": "Curator-authored description to be supplied.",
      "parentId": "area-susie-carson",
      "sortOrder": 8,
      "status": "published",
      "coverItemId": "demo-0020"
    },
    {
      "id": "collection-susie-carson-homelife",
      "title": "Homelife",
      "description": "Curator-authored description to be supplied.",
      "parentId": "area-susie-carson",
      "sortOrder": 9,
      "status": "published",
      "coverItemId": "demo-0021"
    },
    {
      "id": "collection-susie-carson-school-days",
      "title": "School Days",
      "description": "Curator-authored description to be supplied.",
      "parentId": "area-susie-carson",
      "sortOrder": 10,
      "status": "published",
      "coverItemId": "demo-0023"
    },
    {
      "id": "collection-periodicals-southport-historical-society-newsletters",
      "title": "Southport Historical Society Newsletters",
      "description": "Curator-authored description to be supplied.",
      "parentId": "area-periodicals",
      "sortOrder": 11,
      "status": "published",
      "coverItemId": "demo-0024"
    },
    {
      "id": "collection-reference-early-settlements",
      "title": "Early Settlements",
      "description": "Curator-authored description to be supplied.",
      "parentId": "area-reference",
      "sortOrder": 12,
      "status": "published",
      "coverItemId": "demo-0042"
    },
    {
      "id": "collection-reference-maritme",
      "title": "Maritme",
      "description": "Curator-authored description to be supplied.",
      "parentId": "area-reference",
      "sortOrder": 13,
      "status": "published",
      "coverItemId": "demo-0043"
    },
    {
      "id": "collection-reference-cape-fear-region",
      "title": "Cape Fear Region",
      "description": "Curator-authored description to be supplied.",
      "parentId": "area-reference",
      "sortOrder": 14,
      "status": "published",
      "coverItemId": "demo-0044"
    },
    {
      "id": "collection-reference-military",
      "title": "Military",
      "description": "Curator-authored description to be supplied.",
      "parentId": "area-reference",
      "sortOrder": 15,
      "status": "published",
      "coverItemId": "demo-0048"
    },
    {
      "id": "collection-reference-american-revolution",
      "title": "American Revolution",
      "description": "Curator-authored description to be supplied.",
      "parentId": "area-reference",
      "sortOrder": 16,
      "status": "published",
      "coverItemId": "demo-0050"
    },
    {
      "id": "collection-reference-subject-files",
      "title": "Subject Files",
      "description": "Curator-authored description to be supplied.",
      "parentId": "area-reference",
      "sortOrder": 17,
      "status": "published",
      "coverItemId": "demo-0054"
    },
    {
      "id": "collection-genealogy-people-genealogy-files",
      "title": "People/Genealogy Files",
      "description": "Curator-authored description to be supplied.",
      "parentId": "area-genealogy",
      "sortOrder": 18,
      "status": "published",
      "coverItemId": "demo-0059"
    },
    {
      "id": "collection-organizations-southport-woman-s-club-collection",
      "title": "Southport Woman's Club Collection",
      "description": "Curator-authored description to be supplied.",
      "parentId": "area-organizations",
      "sortOrder": 19,
      "status": "published",
      "coverItemId": "demo-0077"
    },
    {
      "id": "collection-organizations-woodbine-garden-club",
      "title": "Woodbine Garden Club",
      "description": "Curator-authored description to be supplied.",
      "parentId": "area-organizations",
      "sortOrder": 20,
      "status": "published",
      "coverItemId": "demo-0081"
    },
    {
      "id": "collection-organizations-wc-history-photos",
      "title": "WC History Photos",